,fandom_id,character_1,character_2,summary
0,25964908,Alice,Bob,"Alice and Bob are two characters featured in the Star Wars fandom. Alice is a Force-sensitive being from a long-line of Jedi Knights, while Bob is a smuggler and thief. Despite their different backgrounds, Alice and Bob share a unique bond and a deep respect for each other. During their travels, they learn to rely on each other and discover the power of the Force within them. Together, they are able to fight against the dark side of the Force and restore the balance of the galaxy. Their relationship is characterized by loyalty, trust and strength, showing that even in the darkest of times, love and friendship can prevail."
1,25964908,Sidious,Cody,"In the Star Wars fandom, the relationship between Sidious and Cody is a complex one. Sidious is ruthless and relentless in his pursuit of power, while Cody is loyal but also sly and crafty. Sidious sees Cody as an asset, and trusts him to carry out difficult tasks. Cody, however, is hesitant to blindly follow Sidious' orders, often trying to find ways to outwit his master while still fulfilling his duties. Cody's loyalty to the Republic and his fellow clones often puts him in conflict with Sidious' ambitions, and while Sidious is often frustrated by Cody's disobedience, he also shows a degree of respect for his skills and abilities. Ultimately, the two characters form an uneasy alliance, with Sidious using his cunning to manipulate Cody into serving his ends, and Cody using his loyalty and skill to protect his master from harm."
2,25964908,Sidious,Commander Cody,"The relationship between Darth Sidious and Commander Cody in the Star Wars universe is one of power, trust, and loyalty. Sidious is a powerful and manipulative Sith Lord, while Cody is a loyal and skilled Clone Commander. Despite their differences, Sidious and Cody form a strong bond of friendship and trust, with Cody following Sidious' orders without hesitation. Through their shared adventures, their respect for one another grows and they eventually become one of the most formidable teams in the Star Wars universe."
3,25964908,General Mundi,Tapal,"Summary:

General Mundi and Tapal are characters in the Star Wars fandom, renowned for their unique relationship and loyalty to each other. Mundi is a brave Clone Commander, serving under Darth Sidious, who is willing to defy orders and risk punishment in order to do what is right. Tapal is a wise Jedi Master, who uses his knowledge and experience to guide Mundi and protect those he cares about. Together, they form a strong bond of friendship, respect, and loyalty that is unwavering in the face of overwhelming danger. As they battle against the forces of evil, they become an example of how courage, loyalty, and friendship can conquer any challenge."
4,25964908,Sidious,Ahsoka Tano,"The relationship between Sidious and Ahsoka is characterized by tension and mistrust, as they each remain wary of the other's intentions. Their interactions during the Clone Wars demonstrate Sidious's determination to eliminate Ahsoka and her defiance of his orders. Despite his attempts to manipulate the situation to his advantage, Ahsoka is able to remain true to her ideals and refuses to be intimidated. In the end, Sidious is forced to accept that his orders have been thwarted, but he still holds Ahsoka in high regard."
5,25964908,Sidious,Fox,"In the Star Wars fandom, Darth Sidious and Commander Fox have a complex relationship. Sidious is a powerful Sith Lord who is cunning and manipulative, using Fox as a means to further his own agenda. Fox is a young Force user taken in by Sidious and trained to be his apprentice, and is fiercely loyal to the Republic. Despite the power imbalance between them, Sidious and Fox have an understanding of one another, with Sidious treating Fox more like a son than an apprentice. This relationship serves as a reminder that even in the darkest of times, hope can still be found."
