,fandom_id,character_1,character_2,summary
0,3382706,Rigel,James,"In this fandom, Rigel and James are a pair of mischievous troublemakers who have a deep connection and care for each other. Despite their differences, they have grown close while attending Hogwarts and share a love of adventure and mischief. Rigel is the brains of the duo, coming up with ideas and schemes to further their adventures, while James is the brawn, often providing protection and support. They are often seen together in school or exploring the grounds of Hogwarts. They rely on each other for friendship and support and have a strong bond that has been further strengthened by the betrothal contract between them."
1,3382706,James,Rigel,"In this fandom, Rigel and James are a pair of mischievous troublemakers who have a deep connection and care for each other. Despite their differences, they have grown close while attending Hogwarts and share a love of adventure and mischief. Rigel is the brains of the duo, coming up with ideas and schemes to further their adventures, while James is the brawn, often providing protection and support. They are often seen together in school or exploring the grounds of Hogwarts. They rely on each other for friendship and support and have a strong bond that has been further strengthened by the betrothal contract between them."
2,3382706,James,Rigel,"In this fandom, Rigel and James are a pair of mischievous troublemakers who have a deep connection and care for each other. Despite their differences, they have grown close while attending Hogwarts and share a love of adventure and mischief. Rigel is the brains of the duo, coming up with ideas and schemes to further their adventures, while James is the brawn, often providing protection and support. They are often seen together in school or exploring the grounds of Hogwarts. They rely on each other for friendship and support and have a strong bond that has been further strengthened by the betrothal contract between them."
3,3382706,Sirius,James,"Sirius Black and James Potter are two of the most iconic characters in the Harry Potter fandom. As close friends since childhood, their bond is strong and full of mutual respect. They often get into mischief together and have a unique connection filled with understanding and trust. Despite their differences in personality, they always put their differences aside and are willing to do anything for one another. Even when Sirius is sent to Azkaban, James never stops believing in him and they remain close friends. Their relationship is a testament to true friendship, and their loyalty to each other is unwavering."
4,3382706,Sirius Black,Rigel Black,"This summary focuses on the relationship between Sirius Black and Rigel Black from the Harry Potter fandom by J.K. Rowling. Sirius is a brave and loyal member of the Order of the Phoenix, while Rigel is an intelligent and loyal student at Hogwarts School of Witchcraft and Wizardry. Despite the differences in their personalities, they have a close bond and Sirius is always looking out for Rigel's best interests. He arranges a betrothal contract between Rigel and his best friend James Potter, and offers the couple a ring from his family's vault as a symbol of his support. Through their relationship, Sirius and Rigel demonstrate their commitment to protecting one another and ensuring the safety of their family."
