,fandom_id,character_1,character_2,summary
29,17099468,Spider-Man,Captain America,"In the Marvel Cinematic Universe fandom, Spider-Man and Captain America have a strong bond of respect and admiration, despite their differences. Spider-Man is an energetic and witty young hero, while Captain America is a seasoned veteran with a strong sense of justice. Their relationship begins with Spider-Man's determination to impress Captain America, as he follows him to a bar in Bed Stuy and is eventually accepted. Captain America often offers his wisdom and guidance to Spider-Man, while Spider-Man provides moral support and friendship to Captain America. Captain America often expresses his admiration for Spider-Man's bravery and enthusiasm, while Spider-Man looks up to Captain America as a role model. The friendship between Captain America and his best friend, Bucky Barnes, further strengthens their bond, emphasizing the importance of friendship and loyalty in the face of adversity."
30,17099468,Sam,Steve,"Sam and Steve have a relationship based on unconditional love and support. Sam is a highly skilled international assassin, while Steve is a former soldier who is looking for love. Sam is initially suspicious of Steve, but warms up to him as he shows his loyalty and trust. Steve is persistent in his efforts to win Sam over, and eventually takes a quinjet and rides his bike across town to meet her at the Swell Dive bar. After Steve reveals his past as a HYDRA operative, Sam is understanding and supportive, helping Steve to move forward with his life and celebrating his eventual peace. Through their journey, they form a strong bond and are a beloved part of the Marvel Cinematic Universe fandom."
31,17099468,The Soldier,Steve,"Steve Rogers and The Soldier (Bucky Barnes) have a complex relationship built on Steve's selfless attempts to earn The Soldier's trust and loyalty. Steve is a brave and courageous old-fashioned soldier, while The Soldier is a highly trained assassin with a mysterious past. Despite The Soldier's initial reluctance to open up to Steve, Steve persists in winning The Soldier's affection, using FRIDAY's assistance to locate him. Through Steve's kindness and understanding, The Soldier gradually begins to trust Steve and the two form a strong bond. Despite the obstacles they face, Steve and The Soldier's connection is strong enough to help them move past their differences and begin a relationship."
32,17099468,Steve,Soldier,"Steve Rogers is a brave, courageous, and justice-seeking superhero who is willing to put his life on the line for the greater good. Soldier, formerly known as Bucky Barnes, is an international assassin who was once part of HYDRA's brainwashing program, and is slowly learning to trust again. Despite their differences, Steve and Bucky are drawn together, both in fights against enemies and in moments of understanding. Steve is determined to earn Bucky's trust and eventually succeeds. Through their shared experiences, Steve and Bucky form an unbreakable bond of friendship and trust, one that transcends even their tumultuous history. Together, they are able to move past the pain of the past and enjoy a life of peace and happiness."
33,17099468,Steve,Bucky,"Steve Rogers and Bucky Barnes share a long and complex relationship that has been tested throughout the Marvel Cinematic Universe. As childhood friends, Steve was a headstrong leader and Bucky was a rebellious assassin. Despite their differences, they have a deep bond of loyalty and trust that is unbreakable. Steve is determined to prove to Bucky that he still cares for him, often attempting to bridge the gap between them. Bucky, in turn, is incredibly protective of Steve, leaving him gifts of food and trying to keep him safe from harm. Through their battles and confrontations, the two eventually reconcile and become a formidable team. Their relationship is an inspiring example of true friendship and loyalty, as Steve and Bucky are willing to risk their lives for each other and understand each other's feelings."
34,17099468,Steve,Bucky,"Steve Rogers and Bucky Barnes share a long and complex relationship that has been tested throughout the Marvel Cinematic Universe. As childhood friends, Steve was a headstrong leader and Bucky was a rebellious assassin. Despite their differences, they have a deep bond of loyalty and trust that is unbreakable. Steve is determined to prove to Bucky that he still cares for him, often attempting to bridge the gap between them. Bucky, in turn, is incredibly protective of Steve, leaving him gifts of food and trying to keep him safe from harm. Through their battles and confrontations, the two eventually reconcile and become a formidable team. Their relationship is an inspiring example of true friendship and loyalty, as Steve and Bucky are willing to risk their lives for each other and understand each other's feelings."
35,17099468,Bucky,Captain Rogers,"Bucky Barnes and Steve Rogers, from the Marvel Cinematic Universe, share a deep bond of loyalty and trust. Despite Bucky's history as a HYDRA assassin, Steve never gave up on him and has consistently worked to rescue and restore him. In the movie, a meaningful look between the two confirms their strong relationship. Steve understands the guilt and regret that Bucky struggles with, and reassures him that he is not responsible for his past. Bucky demonstrates his love for Steve in the Avengers Tower, and the two share a tender, intimate moment of reconciliation. The fandom emphasizes the strength of their relationship and how Steve's unwavering commitment to Bucky serves as a sign of their unbreakable bond."
