,fandom_id,character_1,character_2,summary
0,17099468,Steve,Winter Soldier,"Steve Rogers and Bucky Barnes are complex characters from the Marvel Cinematic Universe who share a strong connection. Steve, also known as Captain America, is a symbol of justice and courage, while Bucky is a former weaponized assassin. Despite their differences, Steve is determined to win over the Winter Soldier and form a connection. He offers him compliments, gifts, and food, and the Winter Soldier slowly begins to open up. Despite warnings from his friends, Steve persists in his attempts to get to know the Winter Soldier better, eventually earning his trust and forming a bond based on trust, understanding, and mutual respect. Through their conversations and physical sparring, Steve is able to get the Soldier to open up about his past and encourages him to look at it from a different perspective. In the end, Steve is able to show the Soldier that he is capable of change and is not defined by his past. This ultimately leads to them falling in love and forming a deep bond of understanding and compassion, proving that love has the power to conquer all obstacles."
1,17099468,Steve,Stephanie,"Steve Rogers and Stephanie Romanoff form a complex yet close bond in the Marvel Cinematic Universe. Steve is a kindhearted leader of the Avengers, admired for his courage and optimism. Stephanie is a former assassin known as the Winter Soldier, with a past full of darkness and pain. Despite this, Steve and Stephanie are able to recognize each other's struggles and build a strong connection. Steve shows Stephanie compassion and understanding, while Stephanie is able to be vulnerable and open up around him. When Steve is reunited with his childhood best friend, Bucky Barnes, Stephanie is supportive of their relationship and encourages them. In the end, Steve and Bucky find the happiness they have been searching for and Stephanie is happy for them, taking comfort in the knowledge that her friend is in good hands."
2,17099468,Clint,Natasha,"Clint and Natasha are two characters from the Marvel Cinematic Universe with a strong bond of friendship, trust, and loyalty. Clint is a master archer and former agent of S.H.I.E.L.D., while Natasha is a highly trained Russian spy and assassin. Despite their different backgrounds and personalities, they share a strong connection and understanding of each other, developed through their missions and adventures. Clint is protective of Natasha and is willing to put his life on the line to save her, while Natasha trusts Clint and is willing to open up to him about her past. Their relationship is one of mutual respect and admiration, and they are an example of true friendship and loyalty in the face of danger."
3,17099468,Clint,Natasha,"Clint and Natasha are two characters from the Marvel Cinematic Universe with a strong bond of friendship, trust, and loyalty. Clint is a master archer and former agent of S.H.I.E.L.D., while Natasha is a highly trained Russian spy and assassin. Despite their different backgrounds and personalities, they share a strong connection and understanding of each other, developed through their missions and adventures. Clint is protective of Natasha and is willing to put his life on the line to save her, while Natasha trusts Clint and is willing to open up to him about her past. Their relationship is one of mutual respect and admiration, and they are an example of true friendship and loyalty in the face of danger."
4,17099468,Clint,Cap,"Clint and Steve have a unique and powerful relationship in the Marvel Cinematic Universe. Although their personalities and opinions differ, their trust and loyalty to each other is undeniable. Clint is an international assassin while Steve is a legendary superhero, but they work together to protect the world and provide moral and tactical support for each other. Clint demonstrates a generous side when he throws a box of chocolates at a criminal's head to save Steve. In another instance, Clint shows his appreciation for Steve by breaking his “no touch” barrier and shaking his hand. Steve reciprocates this gesture by giving Clint a thank you card without any writing inside. These moments demonstrate the deep bond and understanding between the two characters, and serve as a reminder of the power of friendship."
5,17099468,Widow,Cap,"In the Marvel Cinematic Universe fandom, Widow and Cap have a complex and meaningful relationship. Widow is a former HYDRA agent and Cap is a World War II super soldier, and their bond is founded on mutual respect and understanding. They often rely on each other in difficult situations, with Widow providing emotional support and Cap providing physical strength. Widow pushes Cap to be more confident in himself and his relationships, while Cap helps Widow to open up and accept her own emotions. Despite their different backgrounds, they have formed a strong and resilient bond full of love and understanding. Cap holds a special place in his heart for Widow and often seeks advice from his friend Spider-Man on how to express his feelings for her. Widow also shows her feelings for Cap through grand gestures, such as giving him a pair of socks out of the blue. Together, they have gone out of their way to help each other, with Widow risking her life to save Cap and Cap being willing to sacrifice himself to protect Widow."
6,17099468,Steve,Murad,"Steve Rogers and Murad, two characters from Marvel Cinematic Universe, have a unique bond of trust and understanding. Steve is a brave leader and former soldier, while Murad is a mysterious figure, known as the Winter Soldier. Despite their contrasting personalities, Steve is determined to win Murad's affections and bridge the gap between them. With the support of his friends, Natasha, Clint, Sam, Tony, Friday, and Peter, Steve's efforts eventually pay off and the two grow closer. Steve shows Murad an act of compassion, freeing him of his brainwashing and allowing him to regain his memories. Murad is moved and surprises Steve with a romantic gesture that fills his home with glowing glass globes and tea lights. Steve is moved by Bucky's gesture, and the two form a strong bond of love and understanding. The story emphasizes the power of friendship and Steve's courage and commitment, as he never gives up on Murad despite the obstacles they face."
7,17099468,Steve,The Soldier,"Steve Rogers and The Soldier (Bucky Barnes) have a complex relationship built on Steve's selfless attempts to earn The Soldier's trust and loyalty. Steve is a brave and courageous old-fashioned soldier, while The Soldier is a highly trained assassin with a mysterious past. Despite The Soldier's initial reluctance to open up to Steve, Steve persists in winning The Soldier's affection, using FRIDAY's assistance to locate him. Through Steve's kindness and understanding, The Soldier gradually begins to trust Steve and the two form a strong bond. Despite the obstacles they face, Steve and The Soldier's connection is strong enough to help them move past their differences and begin a relationship."
8,17099468,Clint,Steve,"Clint and Steve from the Marvel Cinematic Universe have a complex relationship built on trust, loyalty, and mutual respect. Despite their differences in personality and background, Steve and Clint share a deep understanding and appreciation for each other. Steve is a super soldier while Clint is an international mercenary, and the two have gone on many missions together. Steve often brings Clint food from Murad's, a local falafel shop, as a sign of his appreciation. Clint's teasing of Steve, in a friendly manner, is a testament to the strong bond between them. When Steve decides to pursue the Winter Soldier, Clint is supportive and gives him advice on how to win him over. This leads to a tender moment between the two of them, with Steve and Clint embracing each other warmly, showing a level of affection between them that Murad had never seen before."
9,17099468,Natasha,Steve,"Natasha Romanoff and Steve Rogers have a unique bond that has grown over time. Natasha is a highly skilled and experienced former spy and assassin, while Steve is a patriotic and courageous superhero. Despite their differences, they have a mutual respect and admiration for each other, and often work together to save the world. Their relationship is characterized by understanding, loyalty, and protection. Natasha is willing to overlook Steve's impulsiveness, while Steve is understanding and supportive of her. They tease and banter with each other, but in moments of emotional honesty, they rely on their shared experiences to connect. Most recently, they have been working together to take down a powerful Russian mobster, Kazi, further strengthening their bond."
10,17099468,The Soldier,Crossbones,"The Soldier and Crossbones have a complicated relationship in the Marvel Cinematic Universe. The Soldier is a mysterious former HYDRA agent and international assassin, while Crossbones is a close friend of Captain America and a member of the Avengers. Despite their adversarial past, they come to form a deep bond based on trust and mutual respect. The Soldier, initially guarded and suspicious of Crossbones, learns to appreciate his loyalty and courage, while Crossbones admires The Soldier's strength and willingness to help others. When Crossbones shows an act of kindness to the Soldier, culminating in a tender kiss, it serves as a testament to the strength of their bond. Through their friendship, they learn to accept and appreciate each other’s differences, and the story ends with them walking together towards a brighter future."
11,17099468,Widow,Cap,"In the Marvel Cinematic Universe fandom, Widow and Cap have a complex and meaningful relationship. Widow is a former HYDRA agent and Cap is a World War II super soldier, and their bond is founded on mutual respect and understanding. They often rely on each other in difficult situations, with Widow providing emotional support and Cap providing physical strength. Widow pushes Cap to be more confident in himself and his relationships, while Cap helps Widow to open up and accept her own emotions. Despite their different backgrounds, they have formed a strong and resilient bond full of love and understanding. Cap holds a special place in his heart for Widow and often seeks advice from his friend Spider-Man on how to express his feelings for her. Widow also shows her feelings for Cap through grand gestures, such as giving him a pair of socks out of the blue. Together, they have gone out of their way to help each other, with Widow risking her life to save Cap and Cap being willing to sacrifice himself to protect Widow."
12,17099468,Steve,Winter Soldier,"Steve Rogers and Bucky Barnes are complex characters from the Marvel Cinematic Universe who share a strong connection. Steve, also known as Captain America, is a symbol of justice and courage, while Bucky is a former weaponized assassin. Despite their differences, Steve is determined to win over the Winter Soldier and form a connection. He offers him compliments, gifts, and food, and the Winter Soldier slowly begins to open up. Despite warnings from his friends, Steve persists in his attempts to get to know the Winter Soldier better, eventually earning his trust and forming a bond based on trust, understanding, and mutual respect. Through their conversations and physical sparring, Steve is able to get the Soldier to open up about his past and encourages him to look at it from a different perspective. In the end, Steve is able to show the Soldier that he is capable of change and is not defined by his past. This ultimately leads to them falling in love and forming a deep bond of understanding and compassion, proving that love has the power to conquer all obstacles."
13,17099468,Steve,Natasha,"Natasha Romanoff and Steve Rogers have a unique bond that has grown over time. Natasha is a highly skilled and experienced former spy and assassin, while Steve is a patriotic and courageous superhero. Despite their differences, they have a mutual respect and admiration for each other, and often work together to save the world. Their relationship is characterized by understanding, loyalty, and protection. Natasha is willing to overlook Steve's impulsiveness, while Steve is understanding and supportive of her. They tease and banter with each other, but in moments of emotional honesty, they rely on their shared experiences to connect. Most recently, they have been working together to take down a powerful Russian mobster, Kazi, further strengthening their bond."
14,17099468,Steve,Soldier,"Steve Rogers is a brave, courageous, and justice-seeking superhero who is willing to put his life on the line for the greater good. Soldier, formerly known as Bucky Barnes, is an international assassin who was once part of HYDRA's brainwashing program, and is slowly learning to trust again. Despite their differences, Steve and Bucky are drawn together, both in fights against enemies and in moments of understanding. Steve is determined to earn Bucky's trust and eventually succeeds. Through their shared experiences, Steve and Bucky form an unbreakable bond of friendship and trust, one that transcends even their tumultuous history. Together, they are able to move past the pain of the past and enjoy a life of peace and happiness."
15,17099468,Murad,Steve,"Steve Rogers and Murad, two characters from Marvel Cinematic Universe, have a unique bond of trust and understanding. Steve is a brave leader and former soldier, while Murad is a mysterious figure, known as the Winter Soldier. Despite their contrasting personalities, Steve is determined to win Murad's affections and bridge the gap between them. With the support of his friends, Natasha, Clint, Sam, Tony, Friday, and Peter, Steve's efforts eventually pay off and the two grow closer. Steve shows Murad an act of compassion, freeing him of his brainwashing and allowing him to regain his memories. Murad is moved and surprises Steve with a romantic gesture that fills his home with glowing glass globes and tea lights. Steve is moved by Bucky's gesture, and the two form a strong bond of love and understanding. The story emphasizes the power of friendship and Steve's courage and commitment, as he never gives up on Murad despite the obstacles they face."
16,17099468,Captain America,Winter Soldier,"Captain America (Steve Rogers) and Winter Soldier (Bucky Barnes) have a multi-layered relationship in the Marvel Cinematic Universe. As childhood friends, they share a strong bond of trust and respect. When the Winter Soldier is brainwashed into becoming a deadly assassin for HYDRA, Captain America works tirelessly to restore his memories and help him break free from his programming. Despite their differences, Steve shows kindness and compassion towards Bucky, going out of his way to buy him falafels and stopping by his bar. Tony Stark intervenes in the relationship by arranging a meeting at the airport, which leads to Steve revealing his newfound hobby of writing romance novels. Despite facing many challenges together, their friendship is ultimately strong enough to overcome any obstacle."
17,17099468,Hawkeye,Soldier,"Hawkeye and Soldier are two characters from the Marvel Cinematic Universe. Hawkeye, also known as Steve Rogers, is an experienced and masterful agent, strategist, and archer. Soldier, also known as Bucky Barnes, is a former enemy of the Avengers and has a robotic arm and a troubled past. Despite their differences, the two have formed a strong bond of friendship and understanding. Hawkeye is willing to help Soldier in difficult situations and offers advice on how to express his feelings for Steve. In one instance, Hawkeye throws chocolate at Crossbones to distract him and allows Soldier to take control of the situation. In addition, Hawkeye also reveals a gift he has made for Soldier, showing his loyalty and appreciation for him. This demonstrates the respect and admiration they have for each other, and their deep connection and bond based on trust and understanding."
18,17099468,Sam,Steve Rogers,"Sam and Steve Rogers are two characters in the Marvel Cinematic Universe who are connected by their shared history from World War II and their friendship. Steve is portrayed as a brave and compassionate leader, determined to use his superpowers for good. He is loyal to his friends and willing to put his own safety on the line to protect them. Sam is a former soldier who is still struggling to come to terms with his past. He serves as a confidant to Steve and uses his wisdom and experience to guide him in times of need. Their relationship is one of mutual respect and admiration, and they both rely on one another to become the best versions of themselves. Despite their age difference and the fact that Sam is carrying the burden of his past, they have a strong bond and remain close even after the war."
19,17099468,Tony,FRIDAY,"Tony Stark and FRIDAY, his artificially intelligent assistant from Marvel Cinematic Universe, share a unique relationship built on trust, respect, and understanding. Tony, a genius, billionaire, playboy, philanthropist, relies on FRIDAY for assistance in managing his businesses, personal life, and superhero duties. FRIDAY is programmed to be loyal and obedient to Tony, but also has a personality of her own and provides him with advice and guidance. FRIDAY is willing to risk her own safety to protect Tony and the two have a strong bond of friendship, which allows them to overcome all obstacles together. FRIDAY is loyal, compassionate, humorous, and always there for Tony no matter what, making them an unstoppable team in their mission."
20,17099468,Tony,Steve,"Tony Stark and Steve Rogers from Marvel Cinematic Universe have a unique relationship. Tony is a genius billionaire playboy philanthropist and Steve is a super soldier from the 1940s with an unshakeable moral code. Despite their differing personalities, the two form a strong bond of friendship and loyalty. On one mission, the team encounters the mysterious Winter Soldier, a former assassin. Tony helps Steve out of a tough situation and takes him to an abandoned studio to practice hand-to-hand combat, and during the session they share a deep conversation about Tony's fears of being an enemy of the world. This leads to a mutual understanding and respect for each other's strengths and abilities. Through this mission, Tony and Steve also help the Winter Soldier to connect with them on a deeper level and develop a relationship based on trust and understanding. Together, they form the foundation of the Marvel Cinematic Universe fandom, showing how strong bonds can be formed in spite of differences."
21,17099468,Tony,Pepper,"Tony Stark and Pepper Potts have an inseparable bond in the Marvel Cinematic Universe. Tony is a genius, billionaire, and playboy philanthropist, while Pepper is his assistant and confidante. They have a strong bond of trust and loyalty, which is exemplified when Tony steps in to help Steve Rogers win over the Winter Soldier. Tony and Pepper are always willing to risk their safety for each other and demonstrate their resilience, courage, and love in the face of danger. Despite their differences, Tony and Pepper demonstrate an inspiring example of love and resilience in their interactions, which are often humorous and heartwarming."
22,17099468,Steve,Natasha,"Natasha Romanoff and Steve Rogers have a unique bond that has grown over time. Natasha is a highly skilled and experienced former spy and assassin, while Steve is a patriotic and courageous superhero. Despite their differences, they have a mutual respect and admiration for each other, and often work together to save the world. Their relationship is characterized by understanding, loyalty, and protection. Natasha is willing to overlook Steve's impulsiveness, while Steve is understanding and supportive of her. They tease and banter with each other, but in moments of emotional honesty, they rely on their shared experiences to connect. Most recently, they have been working together to take down a powerful Russian mobster, Kazi, further strengthening their bond."
23,17099468,Kate,Steve,"Kate and Steve in the Marvel Cinematic Universe share a strong bond of loyalty and trust. Kate is an expert marksman and scientist with incredible strength and skill, while Steve is a brave and loyal super soldier. Despite their differences, they share a mutual understanding of each other's values and a deep respect for one another. Through their adventures, Steve is determined to earn Kate's trust and does so by bringing her a special gift. However, Kate's focus is on her mission and she often uses Steve as bait. Despite this, they maintain a friendly banter and Steve is hopeful that their relationship could develop further. In the end, Kate and Steve rely on each other to do the right thing and demonstrate the power of true friendship and love."
24,17099468,Steve,Kate,"Kate and Steve in the Marvel Cinematic Universe share a strong bond of loyalty and trust. Kate is an expert marksman and scientist with incredible strength and skill, while Steve is a brave and loyal super soldier. Despite their differences, they share a mutual understanding of each other's values and a deep respect for one another. Through their adventures, Steve is determined to earn Kate's trust and does so by bringing her a special gift. However, Kate's focus is on her mission and she often uses Steve as bait. Despite this, they maintain a friendly banter and Steve is hopeful that their relationship could develop further. In the end, Kate and Steve rely on each other to do the right thing and demonstrate the power of true friendship and love."
25,17099468,Steve,Tony,"Tony Stark and Steve Rogers from Marvel Cinematic Universe have a unique relationship. Tony is a genius billionaire playboy philanthropist and Steve is a super soldier from the 1940s with an unshakeable moral code. Despite their differing personalities, the two form a strong bond of friendship and loyalty. On one mission, the team encounters the mysterious Winter Soldier, a former assassin. Tony helps Steve out of a tough situation and takes him to an abandoned studio to practice hand-to-hand combat, and during the session they share a deep conversation about Tony's fears of being an enemy of the world. This leads to a mutual understanding and respect for each other's strengths and abilities. Through this mission, Tony and Steve also help the Winter Soldier to connect with them on a deeper level and develop a relationship based on trust and understanding. Together, they form the foundation of the Marvel Cinematic Universe fandom, showing how strong bonds can be formed in spite of differences."
26,17099468,Bucky,Kid,"Bucky Barnes and Kid from the Marvel Cinematic Universe fandom share a strong bond, with Bucky being a former Winter Soldier and Kid being a delivery bot created by Tony Stark. Despite their vastly different backgrounds, Bucky's loyalty and kindness eventually win Kid over, and the two form a formidable team as they protect Steve Rogers from any danger. Bucky's unconditional love and support helps Kid to grow and learn, while Kid expresses his gratitude with a thank you card with no words inside. Their bond is a testament to the strength of friendship and the resilience of the human spirit."
27,17099468,Clint,Winter Soldier,"Clint and Winter Soldier from the Marvel Cinematic Universe share a complex relationship, despite their opposing sides. Clint is a former S.H.I.E.L.D agent and Avenger, while Winter Soldier is a mysterious and dangerous assassin. Despite the tension between them, their connection is deep and they have faced each other in numerous missions. Steve Rogers, a fellow Avenger, tries to bring the two together by offering the Winter Soldier a gift of food. This small gesture of kindness highlights their developing relationship and understanding. As their friendship deepens, Clint begins to research romantic novels in an effort to understand the Winter Soldier better. After a wrestling match, Clint reassures the Winter Soldier that he is still capable of caring for him, which leads to a passionate kiss. This story highlights the bond between Clint and the Winter Soldier, and how despite their past differences, they can form a strong connection and find love in each other."
28,17099468,Steve,Clint,"Clint and Steve from the Marvel Cinematic Universe have a complex relationship built on trust, loyalty, and mutual respect. Despite their differences in personality and background, Steve and Clint share a deep understanding and appreciation for each other. Steve is a super soldier while Clint is an international mercenary, and the two have gone on many missions together. Steve often brings Clint food from Murad's, a local falafel shop, as a sign of his appreciation. Clint's teasing of Steve, in a friendly manner, is a testament to the strong bond between them. When Steve decides to pursue the Winter Soldier, Clint is supportive and gives him advice on how to win him over. This leads to a tender moment between the two of them, with Steve and Clint embracing each other warmly, showing a level of affection between them that Murad had never seen before."
