,fandom_id,character_1,character_2,summary
0,27520969,Harry,Ron,"The story highlights key moments in their relationship, such as when Harry risks his safety to get a ring for Hermione, and when Hermione slaps him for being reckless. Ultimately, these moments demonstrate the strength of their bond and the depth of their friendship. Harry and Ron's relationship is a testament to the power of true friendship, with each of them showing the other just how much they mean to one another."
1,27520969,Hermione,Harry,"The fandom further highlights the strength of their relationship with a romantic gesture from Harry. After a near-death experience during a Death Eater attack on the Ministry, Harry surprises Hermione with a ring that had belonged to his mother and proposes to her. Hermione is taken aback and questions Harry's whereabouts and intentions, but she eventually accepts his proposal and the two share a passionate kiss. This moment demonstrates the depth of their love for each other and the strength of their bond."
2,27520969,Hermione,Harry,"The fandom further highlights the strength of their relationship with a romantic gesture from Harry. After a near-death experience during a Death Eater attack on the Ministry, Harry surprises Hermione with a ring that had belonged to his mother and proposes to her. Hermione is taken aback and questions Harry's whereabouts and intentions, but she eventually accepts his proposal and the two share a passionate kiss. This moment demonstrates the depth of their love for each other and the strength of their bond."
3,27520969,Remus,Hermione,"Remus and Hermione's relationship in the Harry Potter fandom by J.K. Rowling is one of deep loyalty and trust. They develop a strong bond as they embark on adventures together, helping each other face the dangers and difficulties they encounter. Hermione is able to rely on Remus for support and advice, while Remus trusts Hermione's judgment and encourages her to make her own decisions. They share a mutual respect for each other's skills and knowledge, and Remus is not afraid to show his affection for Hermione. Their relationship is ultimately a beautiful example of true friendship and loyalty."
4,27520969,Hermione,Ron,"Overall, Hermione and Ron have a deep connection and are deeply in love. They bring out the best in each other and fight for each other no matter what. Despite their differences, they always find a way to come back together and stay by each other's sides."
5,27520969,Hermione,Harry,"The fandom further highlights the strength of their relationship with a romantic gesture from Harry. After a near-death experience during a Death Eater attack on the Ministry, Harry surprises Hermione with a ring that had belonged to his mother and proposes to her. Hermione is taken aback and questions Harry's whereabouts and intentions, but she eventually accepts his proposal and the two share a passionate kiss. This moment demonstrates the depth of their love for each other and the strength of their bond."
